{
  "events": [
    {
      "details": {
        "hardware_safety_or_classifier_qualification": false,
        "model_id": "unqualified_lumped_average_demand_v1",
        "source_current_a_is_average_demand_surrogate": true
      },
      "time_us": 0,
      "type": "synthetic_model_assumptions"
    }
  ],
  "metadata": {
    "cartridge": {
      "cold_resistance_ohm": 4.0,
      "profile": "unknown",
      "sample_id": null
    },
    "device": {
      "device_id": null,
      "firmware_build_id": null,
      "firmware_git_sha": null,
      "hardware_revision": null,
      "model": "S99"
    },
    "environment": {
      "ambient_temperature_c": 20.0,
      "initial_tip_temperature_c": 20.0,
      "no_contact_verified": null
    },
    "instrumentation": {
      "calibration_ids": null,
      "timebase": "monotonic_since_start_us"
    },
    "probe": {
      "manual_tip_setting": null,
      "profile_id": "caller_supplied_schedule"
    },
    "run_id": null,
    "simulation": {
      "limits": "none; no safety or calibration limits are modeled",
      "model_id": "unqualified_lumped_average_demand_v1",
      "omitted_effects": [
        "pulse_peak_current_and_waveform",
        "switching_transients_and_gate_delay",
        "charger_or_battery_protection",
        "MOSFET_safe_operating_area",
        "firmware_sampling_phase_and_control_loop",
        "contact_or_workpiece_heat_sinking",
        "real_cartridge_variation"
      ],
      "parameters": {
        "ambient_temperature_c": 20.0,
        "heater_coupling_efficiency": 0.25,
        "initial_tip_temperature_c": 20.0,
        "nominal_supply_voltage_v": 5.0,
        "resistance_ohm": 4.0,
        "sample_interval_ms": 100.0,
        "sensor_noise_std_c": 0.05,
        "sensor_time_constant_ms": 100.0,
        "supply_internal_resistance_ohm": 0.2,
        "supply_voltage_noise_std_v": 0.1,
        "thermal_mass_j_per_k": 2.0,
        "thermal_resistance_k_per_w": 3.0
      },
      "seed": 17
    },
    "supply": {
      "contract_current_a": null,
      "contract_voltage_v": 5.0,
      "kind": "unknown",
      "model": null,
      "state": "synthetic_stable_assumption"
    }
  },
  "provenance": "synthetic_model",
  "samples": [
    {
      "ambient_temperature_c": 20.0,
      "dut_input_voltage_v": 5.0,
      "estop_closed": null,
      "gate_source_v": null,
      "gate_state": null,
      "handle_temperature_c": null,
      "heater_commanded": false,
      "heater_current_a": null,
      "interlock_closed": null,
      "mosfet_temperature_c": null,
      "pwm_duty_x256": 0,
      "safety_controller_state": null,
      "source_contract_current_a": null,
      "source_contract_voltage_v": 5.0,
      "source_current_a": 0.0,
      "source_state": "stable_synthetic_assumption",
      "time_us": 0,
      "tip_adc_raw": null,
      "tip_temperature_c": 19.910213964463093,
      "tip_temperature_valid": true
    },
    {
      "ambient_temperature_c": 20.0,
      "dut_input_voltage_v": 4.975036929021376,
      "estop_closed": null,
      "gate_source_v": null,
      "gate_state": null,
      "handle_temperature_c": null,
      "heater_commanded": false,
      "heater_current_a": null,
      "interlock_closed": null,
      "mosfet_temperature_c": null,
      "pwm_duty_x256": 0,
      "safety_controller_state": null,
      "source_contract_current_a": null,
      "source_contract_voltage_v": 5.0,
      "source_current_a": 0.0,
      "source_state": "stable_synthetic_assumption",
      "time_us": 100000,
      "tip_adc_raw": null,
      "tip_temperature_c": 20.04008258953218,
      "tip_temperature_valid": true
    },
    {
      "ambient_temperature_c": 20.0,
      "dut_input_voltage_v": 4.977738083802134,
      "estop_closed": null,
      "gate_source_v": null,
      "gate_state": null,
      "handle_temperature_c": null,
      "heater_commanded": true,
      "heater_current_a": null,
      "interlock_closed": null,
      "mosfet_temperature_c": null,
      "pwm_duty_x256": 2,
      "safety_controller_state": null,
      "source_contract_current_a": null,
      "source_contract_voltage_v": 5.0,
      "source_current_a": 0.009722144694926042,
      "source_state": "stable_synthetic_assumption",
      "time_us": 200000,
      "tip_adc_raw": null,
      "tip_temperature_c": 20.008264153508858,
      "tip_temperature_valid": true
    },
    {
      "ambient_temperature_c": 20.0,
      "dut_input_voltage_v": 4.84282115470237,
      "estop_closed": null,
      "gate_source_v": null,
      "gate_state": null,
      "handle_temperature_c": null,
      "heater_commanded": true,
      "heater_current_a": null,
      "interlock_closed": null,
      "mosfet_temperature_c": null,
      "pwm_duty_x256": 2,
      "safety_controller_state": null,
      "source_contract_current_a": null,
      "source_contract_voltage_v": 5.0,
      "source_current_a": 0.009458635067778066,
      "source_state": "stable_synthetic_assumption",
      "time_us": 300000,
      "tip_adc_raw": null,
      "tip_temperature_c": 19.988104955438384,
      "tip_temperature_valid": true
    },
    {
      "ambient_temperature_c": 20.0,
      "dut_input_voltage_v": 4.957046706750889,
      "estop_closed": null,
      "gate_source_v": null,
      "gate_state": null,
      "handle_temperature_c": null,
      "heater_commanded": true,
      "heater_current_a": null,
      "interlock_closed": null,
      "mosfet_temperature_c": null,
      "pwm_duty_x256": 2,
      "safety_controller_state": null,
      "source_contract_current_a": null,
      "source_contract_voltage_v": 5.0,
      "source_current_a": 0.00968173184912283,
      "source_state": "stable_synthetic_assumption",
      "time_us": 400000,
      "tip_adc_raw": null,
      "tip_temperature_c": 20.049946398929,
      "tip_temperature_valid": true
    },
    {
      "ambient_temperature_c": 20.0,
      "dut_input_voltage_v": 5.014627106508924,
      "estop_closed": null,
      "gate_source_v": null,
      "gate_state": null,
      "handle_temperature_c": null,
      "heater_commanded": true,
      "heater_current_a": null,
      "interlock_closed": null,
      "mosfet_temperature_c": null,
      "pwm_duty_x256": 2,
      "safety_controller_state": null,
      "source_contract_current_a": null,
      "source_contract_voltage_v": 5.0,
      "source_current_a": 0.009794193567400243,
      "source_state": "stable_synthetic_assumption",
      "time_us": 500000,
      "tip_adc_raw": null,
      "tip_temperature_c": 20.001120007428167,
      "tip_temperature_valid": true
    },
    {
      "ambient_temperature_c": 20.0,
      "dut_input_voltage_v": 4.921825683938077,
      "estop_closed": null,
      "gate_source_v": null,
      "gate_state": null,
      "handle_temperature_c": null,
      "heater_commanded": true,
      "heater_current_a": null,
      "interlock_closed": null,
      "mosfet_temperature_c": null,
      "pwm_duty_x256": 2,
      "safety_controller_state": null,
      "source_contract_current_a": null,
      "source_contract_voltage_v": 5.0,
      "source_current_a": 0.009612940788941557,
      "source_state": "stable_synthetic_assumption",
      "time_us": 600000,
      "tip_adc_raw": null,
      "tip_temperature_c": 19.95884347087476,
      "tip_temperature_valid": true
    }
  ],
  "schema_version": "s99.trace.v1",
  "trace_id": "synthetic-fixture-model-only",
  "trace_kind": "synthetic"
}
